{
  "schemaVersion": "sport-context.v1",
  "taxonomyVersion": "sports-taxonomy.v1",
  "season": 2026,
  "generatedAt": "2026-09-30T00:14:02.293Z",
  "sources": [
    {
      "provider": "WRC",
      "sourceUrl": "https://www.wrc.com/en/calendar",
      "sourceType": "official",
      "checkedAt": "2026-09-30T00:14:02.293Z"
    },
    {
      "provider": "FIA",
      "sourceUrl": "https://api.fia.com/events/world-rally-championship/season-2026/standings",
      "sourceType": "official",
      "checkedAt": "2026-09-30T00:14:02.293Z"
    },
    {
      "provider": "Stan Sport",
      "sourceUrl": "https://www.stan.com.au/watch/sport/motorsport/wrc",
      "sourceType": "broadcaster",
      "checkedAt": "2026-09-30T00:14:02.293Z"
    }
  ],
  "sportDomains": [
    {
      "id": "sport:motorsport",
      "slug": "motorsport",
      "name": "Motorsport",
      "kind": "sport",
      "sortOrder": 30,
      "isActive": true,
      "supportsLadders": true,
      "supportsAllFixtures": false,
      "supportsNarrative": true,
      "supportsTeams": true,
      "supportsCompetitors": true,
      "defaultTemplateId": "template:like",
      "metadata": {
        "region": "global",
        "neutralGlyph": "sport:motorsport"
      }
    }
  ],
  "competitionFamilies": [
    {
      "id": "family:world-rally-championship",
      "sportDomainId": "sport:motorsport",
      "slug": "world-rally-championship",
      "name": "FIA World Rally Championship",
      "familyType": "championship",
      "sortOrder": 31,
      "isActive": true
    }
  ],
  "competitions": [
    {
      "id": "competition:wrc-2026",
      "sportDomainId": "sport:motorsport",
      "preferenceDomainId": "sport:wrc",
      "competitionFamilyId": "family:world-rally-championship",
      "slug": "wrc-2026",
      "name": "2026 FIA World Rally Championship",
      "competitionType": "seasonChampionship",
      "seasonLabel": "2026",
      "region": "global",
      "gender": "open",
      "supportsLadder": false,
      "supportsTeams": true,
      "supportsCompetitors": true,
      "isSpecialEvent": false,
      "standingsOnly": false,
      "standingsType": "none",
      "defaultStandingsVisibility": "summary"
    },
    {
      "id": "competition:wrc-drivers-2026",
      "sportDomainId": "sport:motorsport",
      "preferenceDomainId": "sport:wrc",
      "competitionFamilyId": "family:world-rally-championship",
      "slug": "wrc-drivers-2026",
      "name": "2026 WRC Drivers' Championship",
      "competitionType": "seasonChampionship",
      "seasonLabel": "2026",
      "region": "global",
      "gender": "open",
      "supportsLadder": true,
      "supportsTeams": false,
      "supportsCompetitors": true,
      "isSpecialEvent": false,
      "standingsOnly": true,
      "standingsType": "drivers",
      "defaultStandingsVisibility": "summary"
    },
    {
      "id": "competition:wrc-co-drivers-2026",
      "sportDomainId": "sport:motorsport",
      "preferenceDomainId": "sport:wrc",
      "competitionFamilyId": "family:world-rally-championship",
      "slug": "wrc-co-drivers-2026",
      "name": "2026 WRC Co-Drivers' Championship",
      "competitionType": "seasonChampionship",
      "seasonLabel": "2026",
      "region": "global",
      "gender": "open",
      "supportsLadder": true,
      "supportsTeams": false,
      "supportsCompetitors": true,
      "isSpecialEvent": false,
      "standingsOnly": true,
      "standingsType": "coDrivers",
      "defaultStandingsVisibility": "summary"
    },
    {
      "id": "competition:wrc-manufacturers-2026",
      "sportDomainId": "sport:motorsport",
      "preferenceDomainId": "sport:wrc",
      "competitionFamilyId": "family:world-rally-championship",
      "slug": "wrc-manufacturers-2026",
      "name": "2026 WRC Manufacturers' Championship",
      "competitionType": "seasonChampionship",
      "seasonLabel": "2026",
      "region": "global",
      "gender": "open",
      "supportsLadder": true,
      "supportsTeams": true,
      "supportsCompetitors": false,
      "isSpecialEvent": false,
      "standingsOnly": true,
      "standingsType": "manufacturers",
      "defaultStandingsVisibility": "summary"
    }
  ],
  "participants": [
    {
      "id": "competitor:wrc:driver:elfyn-evans",
      "type": "competitor",
      "sportDomainId": "sport:motorsport",
      "displayName": "Elfyn Evans",
      "shortName": "Elfyn Evans",
      "canonicalName": "Elfyn Evans",
      "countryCode": "GB",
      "metadata": {
        "active": true,
        "championshipRole": "driver",
        "preferenceDomainId": "sport:wrc"
      }
    },
    {
      "id": "competitor:wrc:driver:sami-pajari",
      "type": "competitor",
      "sportDomainId": "sport:motorsport",
      "displayName": "Sami Pajari",
      "shortName": "Sami Pajari",
      "canonicalName": "Sami Pajari",
      "countryCode": "FI",
      "metadata": {
        "active": true,
        "championshipRole": "driver",
        "preferenceDomainId": "sport:wrc"
      }
    },
    {
      "id": "competitor:wrc:driver:oliver-solberg",
      "type": "competitor",
      "sportDomainId": "sport:motorsport",
      "displayName": "Oliver Solberg",
      "shortName": "Oliver Solberg",
      "canonicalName": "Oliver Solberg",
      "countryCode": "SE",
      "metadata": {
        "active": true,
        "championshipRole": "driver",
        "preferenceDomainId": "sport:wrc"
      }
    },
    {
      "id": "competitor:wrc:driver:sebastien-ogier",
      "type": "competitor",
      "sportDomainId": "sport:motorsport",
      "displayName": "Sébastien Ogier",
      "shortName": "Sébastien Ogier",
      "canonicalName": "Sébastien Ogier",
      "countryCode": "FR",
      "metadata": {
        "active": true,
        "championshipRole": "driver",
        "preferenceDomainId": "sport:wrc"
      }
    },
    {
      "id": "competitor:wrc:driver:adrien-fourmaux",
      "type": "competitor",
      "sportDomainId": "sport:motorsport",
      "displayName": "Adrien Fourmaux",
      "shortName": "Adrien Fourmaux",
      "canonicalName": "Adrien Fourmaux",
      "countryCode": "FR",
      "metadata": {
        "active": true,
        "championshipRole": "driver",
        "preferenceDomainId": "sport:wrc"
      }
    },
    {
      "id": "competitor:wrc:driver:takamoto-katsuta",
      "type": "competitor",
      "sportDomainId": "sport:motorsport",
      "displayName": "Takamoto Katsuta",
      "shortName": "Takamoto Katsuta",
      "canonicalName": "Takamoto Katsuta",
      "countryCode": "JP",
      "metadata": {
        "active": true,
        "championshipRole": "driver",
        "preferenceDomainId": "sport:wrc"
      }
    },
    {
      "id": "competitor:wrc:driver:thierry-neuville",
      "type": "competitor",
      "sportDomainId": "sport:motorsport",
      "displayName": "Thierry Neuville",
      "shortName": "Thierry Neuville",
      "canonicalName": "Thierry Neuville",
      "countryCode": "BE",
      "metadata": {
        "active": true,
        "championshipRole": "driver",
        "preferenceDomainId": "sport:wrc"
      }
    },
    {
      "id": "competitor:wrc:driver:hayden-paddon",
      "type": "competitor",
      "sportDomainId": "sport:motorsport",
      "displayName": "Hayden Paddon",
      "shortName": "Hayden Paddon",
      "canonicalName": "Hayden Paddon",
      "countryCode": "NZ",
      "metadata": {
        "active": true,
        "championshipRole": "driver",
        "preferenceDomainId": "sport:wrc"
      }
    },
    {
      "id": "competitor:wrc:driver:joshua-mcerlean",
      "type": "competitor",
      "sportDomainId": "sport:motorsport",
      "displayName": "Joshua Mcerlean",
      "shortName": "Joshua Mcerlean",
      "canonicalName": "Joshua Mcerlean",
      "countryCode": "IE",
      "metadata": {
        "active": true,
        "championshipRole": "driver",
        "preferenceDomainId": "sport:wrc"
      }
    },
    {
      "id": "competitor:wrc:driver:esapekka-lappi",
      "type": "competitor",
      "sportDomainId": "sport:motorsport",
      "displayName": "Esapekka Lappi",
      "shortName": "Esapekka Lappi",
      "canonicalName": "Esapekka Lappi",
      "countryCode": "FI",
      "metadata": {
        "active": true,
        "championshipRole": "driver",
        "preferenceDomainId": "sport:wrc"
      }
    },
    {
      "id": "competitor:wrc:driver:yohan-rossel",
      "type": "competitor",
      "sportDomainId": "sport:motorsport",
      "displayName": "Yohan Rossel",
      "shortName": "Yohan Rossel",
      "canonicalName": "Yohan Rossel",
      "countryCode": "FR",
      "metadata": {
        "active": true,
        "championshipRole": "driver",
        "preferenceDomainId": "sport:wrc"
      }
    },
    {
      "id": "competitor:wrc:driver:leo-rossel",
      "type": "competitor",
      "sportDomainId": "sport:motorsport",
      "displayName": "Léo Rossel",
      "shortName": "Léo Rossel",
      "canonicalName": "Léo Rossel",
      "countryCode": "FR",
      "metadata": {
        "active": true,
        "championshipRole": "driver",
        "preferenceDomainId": "sport:wrc"
      }
    },
    {
      "id": "competitor:wrc:driver:robert-virves",
      "type": "competitor",
      "sportDomainId": "sport:motorsport",
      "displayName": "Robert Virves",
      "shortName": "Robert Virves",
      "canonicalName": "Robert Virves",
      "countryCode": "EE",
      "metadata": {
        "active": true,
        "championshipRole": "driver",
        "preferenceDomainId": "sport:wrc"
      }
    },
    {
      "id": "competitor:wrc:driver:jon-armstrong",
      "type": "competitor",
      "sportDomainId": "sport:motorsport",
      "displayName": "Jon Armstrong",
      "shortName": "Jon Armstrong",
      "canonicalName": "Jon Armstrong",
      "countryCode": "IE",
      "metadata": {
        "active": true,
        "championshipRole": "driver",
        "preferenceDomainId": "sport:wrc"
      }
    },
    {